name,price,color,size,description,image,url
"Index Paper Divider , 20 Holes , 5 Tabs , A5, Dark Grey",AED 12.00,Dark Grey,,"Index Paper Divider, 20 Holes, 5 Tabs, A5, Dark Grey",https://media.alshaya.com/adobe/assets/urn:aaid:aem:a72fd22f-a621-40c0-8a20-35ed3be8660c/as/SK-J-4550344296967.jpg?width=638&height=638&preferwebp=true,https://www.muji.ae/en/buy-index-paper-divider-20-holes-5-tabs-a5-dark-grey-dark-grey.html
Acrylic Tape Dispenser For 18mm Wide Tape,AED 9.00,Transparent,,Acrylic Tape dispenser for 18mm wide tape,https://media.alshaya.com/adobe/assets/urn:aaid:aem:4e9b6d26-7151-416b-a882-8c3355e7dfd2/as/SK-J-4550344596593.jpg?width=638&height=638&preferwebp=true,https://www.muji.ae/en/buy-acrylic-tape-dispenser-18mm-wide-tape-transparent.html
"Binder, 20 Holes, A5, Dark Grey",AED 29.00,Dark Grey,,"Lightweight and easy to carry, the binder is easy to organize your documents and share at a meeting in the office. Made from high-quality material, the binder ensures that the papers and documents filed inside to stay safe and secure. This A5 binder is ideal to keep track of receipts, documents, bills, and important documents at the office. Sporting a simple dark grey colour, this binder comes with 20 rings and looks more professional.",https://media.alshaya.com/adobe/assets/urn:aaid:aem:6dace9df-8709-430b-9bbe-73ff1e088498/as/SK-J-4550182110159.jpg?width=638&height=638&preferwebp=true,https://www.muji.ae/en/buy-binder-20-holes-a5-dark-grey-dark-gray.html
"Binder, 20 Holes, A5, Beige",AED 29.00,Beige,,"Lightweight and easy to carry, the binder is easy to organize your documents and share at a meeting in the office. Made from high-quality material, the binder ensures that the papers and documents filed inside to stay safe and secure. This A5 binder is ideal to keep track of receipts, documents, bills, and important documents at the office. Sporting a simple beige colour, this binder comes with 20 rings and looks more professional.",https://media.alshaya.com/adobe/assets/urn:aaid:aem:5f83848c-557c-4d04-9719-aab7cc63cc04/as/SK-J-4550182109979.jpg?width=638&height=638&preferwebp=true,https://www.muji.ae/en/buy-binder-20-holes-a5-beige-beige.html
Bookmark Seal,AED 12.00,Multi,,Bookmark Seal,https://media.alshaya.com/adobe/assets/urn:aaid:aem:2a287eb0-45bd-453c-85d8-f406180e4676/as/SK-J-4548076539636.jpg?width=638&height=638&preferwebp=true,https://www.muji.ae/en/buy-bookmark-seal-multi.html
"Hexagon 6-Color Ballpoint Pen, 0.7 Mm, Black/Red/Pink/Orange/Light Blue/Blue",AED 35.00,Black/Red/Pink/Orange/Light Blue/Blue,,"Ideal for organizing and colour-coding, copy, bullet Journaling, doodling, and much more, the hexagon 6-colour ballpoint pen is a versatile writing tool. Great for use at home, office, or school, this pen is also stylish. This hexagonal axis multicolour ballpoint pen can write in six colours that include black, red, pink, orange, light blue, and blue. The precise and fine tip of 0.7 mm ensures a smooth writing experience.",https://media.alshaya.com/adobe/assets/urn:aaid:aem:ab0544e0-5ddd-453c-9221-086d5efc6f04/as/SK-J-4547315040209.jpg?width=638&height=638&preferwebp=true,https://www.muji.ae/en/buy-hexagon-6-color-ballpoint-pen-07-mm-blackredpinkorangelight-blueblue-black-red-pink-orange-light-blue-blue.html
"Paper Clips, 70 Pieces, Silver",AED 9.00,Silver,,"A must-have office stationery, the paper clips play an important role and come quite handy to organize documents. Available in an easy-to-use case, it is easy to use on the go and convenient to keep in the drawers. Available as 70 Pieces pack, these premium quality metal paper clips are corrosion resistant and do not cause any snags or marks on papers.",https://media.alshaya.com/adobe/assets/urn:aaid:aem:77cb8b9a-905e-4fcc-953a-21321714f223/as/SK-J-4550182207842.jpg?width=638&height=638&preferwebp=true,https://www.muji.ae/en/buy-paper-clips-70-pieces-silver-silver.html
"Double Clips, 6 Pieces, Silver",AED 9.00,Silver,,"Perfect for organizing and clipping documents together, these double clips are very versatile in utility. These high-performance clips come in an easy-to-use case that helps to secure them and keep them organized. Ideal for use to clip office, school, and daily file documents, It can also be used as DIY, bookmarks, photo album clips, business card holders and envelope clips. Each box contains 6 Pieces and is easy to carry on the go.",https://media.alshaya.com/adobe/assets/urn:aaid:aem:6b06b766-d142-4a59-8812-c08f486d4f7b/as/SK-J-4550182207859.jpg?width=638&height=638&preferwebp=true,https://www.muji.ae/en/buy-double-clips-6-pieces-silver-silver.html
"Writable Tape Measure, 2.5 M, White",AED 69.00,White,,"Measuring is an easy task, but when it comes to remembering the measurement, it is difficult. Now, with this writable tape measure, you can write a mark directly on the scale of the measure with a pencil or the like to note down and remember for another similar measurement. You can also write on the backside. This white coloured measuring tape can measure up to a length of 2.5m.",https://media.alshaya.com/adobe/assets/urn:aaid:aem:701ddc23-3d8b-4181-bc7c-a5fbe67be53e/as/SK-J-4550182207828.jpg?width=638&height=638&preferwebp=true,https://www.muji.ae/en/buy-writable-tape-measure-25-m-white-white.html
"7 Mm Horizontal Ruled Line Notebook, 30 Sheets, A4, Beige",AED 15.00,Beige,,"Lightweight, easy to carry with, this 7 mm horizontal ruled line notebook is also great for smooth writing It was created using a thread-binding approach that eliminates needless processing and ornamentation. The cover is simple, and the text has no top, bottom, left, or right margins, allowing it to be used from anywhere. With a plain beige coloured cover, this A4 size notebook is great for students, office workers, and teachers.",https://media.alshaya.com/adobe/assets/urn:aaid:aem:59dc34e6-1708-4ff9-805c-e7757c185ea3/as/SK-J-4550182109580.jpg?width=638&height=638&preferwebp=true,https://www.muji.ae/en/buy-7-mm-horizontal-ruled-line-notebook-30-sheets-a4-beige-beige.html
"6 Mm Horizontal Ruled Line Notebook, 30 Sheets, B5, Beige",AED 15.00,Beige,,"Made of premium quality paper, the 6 mm horizontal ruled line notebook brings a new level of writing experience. It was made with a thread-binding technique that minimises unnecessary processing and decoration. The cover is straightforward, and the text lacks top, bottom, left, and right borders, allowing it to be read from any angle. Sporting an elegant beige colour cover that is plain, this B5 notebook is convenient to carry.",https://media.alshaya.com/adobe/assets/urn:aaid:aem:a44c9a39-7f4d-4d6b-b128-3a46c3e70a6b/as/SK-J-4550182109528.jpg?width=638&height=638&preferwebp=true,https://www.muji.ae/en/buy-6-mm-horizontal-ruled-line-notebook-30-sheets-b5-beige-beige.html
"6 Mm Horizontal Ruled Line Notebook, 30 Sheets, A6, Beige",AED 7.00,Beige,,"A must-have for students, office workers and teachers, this 6 mm horizontal ruled lined notebook is perfect for taking notes, projects, creative writings, and journaling. It was created using a bookbinding approach that uses thread to bind, eliminating extraneous processing, and ornamentation. The cover is unadorned, and the text lacks top, bottom, left, and right margins, allowing you to utilize it from any angle. Featuring a beige colour cover, it comes in A6 size ideal for all writing purposes.",https://media.alshaya.com/adobe/assets/urn:aaid:aem:15364e7c-4d94-4750-a107-ecf414415a12/as/SK-J-4550182109467.jpg?width=638&height=638&preferwebp=true,https://www.muji.ae/en/buy-6-mm-horizontal-ruled-line-notebook-30-sheets-a6-beige-beige.html
"Opens Flat Horizontal Ruled Vertical Dots Paper Notebook, 80 Sheets, A5, Light Grey",AED 35.00,Light Grey,,Create endless opportunities with the open-flat notebook that is perfect for keeping your notes and information organized. The special thread binding methodology allows convenient flat opening of the notebook. The A5 notebook is made from 80 sheets of high-quality paper that feature horizontal ruled lines and vertical dots. The light grey-coloured cover protects the middle paper while adding a professional look.,https://media.alshaya.com/adobe/assets/urn:aaid:aem:b2614c60-5dc4-49f9-9071-9a547c212865/as/SK-J-4550002185213.jpg?width=638&height=638&preferwebp=true,https://www.muji.ae/en/buy-opens-flat-horizontal-ruled-vertical-dots-paper-notebook-80-sheets-a5-light-grey-light-grey.html
"Opens Flat Horizontal Ruled Vertical Dots Paper Notebook, 80 Sheets, B6, Black",AED 29.00,Black,,"The open-flat notebook is the preferred one among professionals, college students, and at home. Crafted with a special thread binding methodology, it allows a flat opening of the notebook. The B6 notebook is made from 80 sheets of high-quality paper that feature horizontal ruled lines and vertical dots. The black-coloured cover adds more grace to its prime features.",https://media.alshaya.com/adobe/assets/urn:aaid:aem:1d548b1e-07e4-448d-9c4e-72758087be4e/as/SK-J-4550002185626.jpg?width=638&height=638&preferwebp=true,https://www.muji.ae/en/buy-opens-flat-horizontal-ruled-vertical-dots-paper-notebook-80-sheets-b6-black-black.html
"Water-Based Felt-Tip Pen, Deep Indigo",AED 12.00,Deep Indigo,,"This premium quality water-based felt-tip pen offers you a phenomenal writing experience. We have a wide variety of calm neutral colours. The smooth writing taste lasts for a long time. Offering a wider application, it works very well on almost all paper surfaces including thin as well as glossy papers. Let your creativity flow in a bright deep indigo shade that\'s livelier.",https://media.alshaya.com/adobe/assets/urn:aaid:aem:7b5a28f2-b26b-4ab0-9fa5-f7130b1f5679/as/SK-J-4550182914139.jpg?width=638&height=638&preferwebp=true,https://www.muji.ae/en/buy-water-based-felt-tip-pen-deep-indigo-deep-indigo.html
"Water-Based Felt-Tip Pen, Apricot",AED 12.00,Apricot,,"With the advanced ink formula, this water-based felt-tip pen helps to draw or highlight with the high standard that is not comparable. We have a wide variety of calm neutral colours. The smooth writing taste lasts for a long time. It has a narrow tip that makes it easier and more comfortable to accurately write delicately attractive illustrious texts. Fun with this colour, the apricot hue for an invigorating spirit.",https://media.alshaya.com/adobe/assets/urn:aaid:aem:6e8dc9c6-92a6-49f8-bf9f-9052026788bf/as/SK-J-4550182914153.jpg?width=638&height=638&preferwebp=true,https://www.muji.ae/en/buy-water-based-felt-tip-pen-apricot-apricot.html
"Water-Based Felt-Tip Pen, Aqua Blue",AED 12.00,Aqua Blue,,"Exceedingly easy to grip, the water-based felt-tip pen sports a unique design that is comfortable to hold the pen for a long time yet write easily without fatigue. With a wide range of peaceful neutral hues to choose from, the choice is entirely yours. It comes in elegant ink colour, the attractive aqua blue colour, that is as vibrant as the ocean yet as subtle as the sky.",https://media.alshaya.com/adobe/assets/urn:aaid:aem:c10538ba-4f56-41a3-aabf-a7616f20b33d/as/SK-J-4550182914122.jpg?width=638&height=638&preferwebp=true,https://www.muji.ae/en/buy-water-based-felt-tip-pen-aqua-blue-aqua-blue.html
"Water-Based Felt-Tip Pen, Olive Green",AED 12.00,Olive Green,,"Create bold, expressive lines for flawlessly pretty handwriting and doodles using the water-based felt-tip pen that is great for writing in journals, sketchbooks, planners, and organizers. The smooth ink formula lasts for a long time and offers you a pleasant writing and drawing experience. Make it all olive green, a colour signifying growth.",https://media.alshaya.com/adobe/assets/urn:aaid:aem:4e42badf-3467-44b7-9d11-93b8a5840fee/as/SK-J-4550182914184.jpg?width=638&height=638&preferwebp=true,https://www.muji.ae/en/buy-water-based-felt-tip-pen-olive-green-olive-green.html
"Polypropylene Double Pen Case, Approx. W 21 X D 7 X H 2.5 Cm",AED 19.00,Clear,,"The polypropylene pen case is divided into a part where you can put a pen and a part where you can put small items. The accessory case is convenient for storing small items such as memory sticks, erasers, and sticky notes.",https://media.alshaya.com/adobe/assets/urn:aaid:aem:fe128468-3f9c-48cd-aafb-2df7c93d03c1/as/SK-J-4550182114553.jpg?width=638&height=638&preferwebp=true,https://www.muji.ae/en/buy-polypropylene-double-pen-case-approx-w-21-x-d-7-x-h-25-cm-clear.html
"Water-Based Felt-Tip Pen, Mustard Yellow",AED 12.00,Mustard Yellow,,"Free-flowing ink creates a thick, bold line using the water-based felt-tip pen that will bring a touch of elegance and pleasure to your writing or drawing. It helps to mark the distinct sections and keywords in your notes with a distinct and different colour. At times, play it subtle, with the mustard yellow colour, only to make it your trademark.",https://media.alshaya.com/adobe/assets/urn:aaid:aem:1aa2e278-59f8-4d55-825f-638cf579de68/as/SK-J-4550182914160.jpg?width=638&height=638&preferwebp=true,https://www.muji.ae/en/buy-water-based-felt-tip-pen-mustard-yellow-mustard-yellow.html
"Water-Based Felt-Tip Pen, Red",AED 12.00,Red,,"Designed in such a way that it is comfortable to hold for long hours, the water-based felt-tip pen is not just meant for the common writers but those with voracious writing habits. Works on most surfaces like wood, fabric, canvas, paper, cardboard, and other writing aids for an elegant look. Let\'s play some fun with the bright colour of life, the red in its most wonderful hue.",https://media.alshaya.com/adobe/assets/urn:aaid:aem:44d203c2-1116-477e-8ee7-35493b4dd2b9/as/SK-J-4550182914115.jpg?width=638&height=638&preferwebp=true,https://www.muji.ae/en/buy-water-based-felt-tip-pen-red-red.html
"Acrylic Box, W 25.2 X D 12.6 X H 8 Cm, M",AED 79.00,Clear,,"Ideally, offering a wide range of utility, the acrylic box is quite helpful to not just keep the essential items but makes it easy to retrieve them as well. These acrylic boxes of the same size or half-size boxes can be stacked side by side. The unique design lets you optimize the storage according to your need by using it in combination with an optional partition or lid. This M-size acrylic box is transparent, clear, and easy to clean.",https://media.alshaya.com/adobe/assets/urn:aaid:aem:10b93e89-685c-4c8f-af6d-d90900521177/as/SK-J-4550344089576.jpg?width=638&height=638&preferwebp=true,https://www.muji.ae/en/buy-acrylic-box-w-252-x-d-126-x-h-8-cm-m-clear.html
"Plain Wirebound Notebook, 80 Sheets, A5, Dark Grey",AED 25.00,Dark Grey,,Paper wire-bound notebook / plain features a double ring that can be folded back 360 degrees for convenient usage. This notebook uses high quality and thick paper which is thicker than other normal notebooks. It contains 80 sheets and a dark grey cover with a rounded corner for easier carrying. The A5 size of this notebook is a perfect size for carrying in your laptop bag.,https://media.alshaya.com/adobe/assets/urn:aaid:aem:60261ee2-8dfc-4cd7-ae51-ed8eaec46c01/as/SK-J-4550182109221.jpg?width=638&height=638&preferwebp=true,https://www.muji.ae/en/buy-plain-wirebound-notebook-80-sheets-a5-dark-grey-dark-grey.html
"Double Ring Plain Notebook, 80 Sheets, A6, Dark Grey",AED 15.00,Dark Grey,,"The double ring plain notebook adds a professional look that suits the boardrooms and conferences. It features a double ring that can be folded back 360 degrees so that you can use the notebook from up, down, left or right. Easy to flip and write conveniently on both sides, this note is the right choice for taking notes in your class.",https://media.alshaya.com/adobe/assets/urn:aaid:aem:5e81ebc8-98d7-4d9e-a599-61cde4b5fe59/as/SK-J-4550182108620.jpg?width=638&height=638&preferwebp=true,https://www.muji.ae/en/buy-double-ring-plain-notebook-80-sheets-a6-dark-grey-dark-grey.html
"High-Quality Paper 6 Mm Horizontal Ruled Line Double Ring Notebook, Rubber Clasp, 80 Sheets, A5, Black",AED 39.00,Black,,"The notebook with ring mobile note is crafted with smooth bright paper that is perfect for using with any ballpoint pens, gel pens, and pencil. The double ring notebook comes with a rubber clasp for easy closing. Featuring a black cover and 80 sheets of high quality in a 6mm horizontal rule pattern, this A5 notebook comes in handy at the office, school, and home.",https://media.alshaya.com/adobe/assets/urn:aaid:aem:603d0b4d-0566-4ef2-a1b0-6d89894f8f6e/as/SK-J-4550182111293.jpg?width=638&height=638&preferwebp=true,https://www.muji.ae/en/buy-high-quality-paper-6-mm-horizontal-ruled-line-double-ring-notebook-rubber-clasp-80-sheets-a5-black-black.html
"Free Schedule Sticky Note, Weekly, 13 Sheets, W 7.5 X L 12 Cm, White",AED 9.00,White,,"Plan your week ahead and bring it to your own attention or address it to your team with this free schedule sticky note that magically adheres to any surface with ease. Further, it is easily removable without leaving any residue. It is a sticky note with a free-form weekly plan on which you may eventually write the date. The specially designed sticky note comes in 13 Sheets of white prints.",https://media.alshaya.com/adobe/assets/urn:aaid:aem:fe1fa50c-9bd5-48c5-827d-69efc49a8ac5/as/SK-J-4550182603156.jpg?width=638&height=638&preferwebp=true,https://www.muji.ae/en/buy-free-schedule-sticky-note-weekly-13-sheets-w-75-x-l-12-cm-white-white.html
"Double Ring Plain Notebook, 80 Sheets, B5, Dark Grey",AED 25.00,Dark Grey,,"The double ring plain notebook adds a professional look that suits the boardrooms and conferences. It features a double ring that can be folded back 360 degrees so that you can use the notebook from up, down, left or right. Easy to flip and write conveniently on both sides, this note is the right choice for taking notes in your class.",https://media.alshaya.com/adobe/assets/urn:aaid:aem:acaca1a7-2927-43e0-b152-ba6cb3c36821/as/SK-J-4550182109160.jpg?width=638&height=638&preferwebp=true,https://www.muji.ae/en/buy-double-ring-plain-notebook-80-sheets-b5-dark-grey-dark-grey.html
"Recycled Paper Wirebound Notebook, 80 Sheets, B5, Beige",AED 25.00,Beige,,"The recycled paper wire-bound notebook makes it easy to write and tear away pages neatly with little effort. Made from high-quality paper, it is smooth to write with any pen, pencil or highlighters. This beige coloured plain double-ring notebook comes with 80 sheets. A double ring that can be folded back 360 degrees. It can be used from either up, down, left or right.",https://media.alshaya.com/adobe/assets/urn:aaid:aem:c0d8834b-4726-45b0-b887-6d5571dc9ea1/as/SK-J-4550182109283.jpg?width=638&height=638&preferwebp=true,https://www.muji.ae/en/buy-recycled-paper-wirebound-notebook-80-sheets-b5-beige-beige.html
"Free Schedule Sticky Note, Monthly, 13 Sheets, W 7.5 X L 12 Cm, White",AED 9.00,White,,"Line up the events and tasks conveniently with this free schedule sticky note and plan your week’s appointments, classes, family dinners, chores and parties easily. It is a free type schedule sticky note with no date printed in advance. You can use it not only in notebooks but also in places that are easy to see. Perfectly sized for small spaces, these sticky notes come in a pack of 13 Sheets.",https://media.alshaya.com/adobe/assets/urn:aaid:aem:1517b30d-537b-4d94-90e0-dd73253a9e6e/as/SK-J-4550182603149.jpg?width=638&height=638&preferwebp=true,https://www.muji.ae/en/buy-free-schedule-sticky-note-monthly-13-sheets-w-75-x-l-12-cm-white-white.html
Line Markers Highlighter,AED 9.00,,,"Ideal for writing a gift card, drawing a picture, design a poster and other creative work, this line markers highlighter is perfect for highlighting the important topics and notes in your notebook. Made from premium quality ink, it ensures provide a smooth free flow highlighting experience. The advanced technology ink does not bloat through the paper making it great for use on all sort of notebooks, magazines, reading books and other reading materials.",https://media.alshaya.com/adobe/assets/urn:aaid:aem:b6961b8b-5cc9-4a76-8053-392862a6cd1f/as/SK-J-4550182439786.jpg?width=638&height=638&preferwebp=true,https://www.muji.ae/en/buy-line-markers-highlighter-smoky-apricot.html
Line Markers Highlighter,AED 9.00,Grey,,"Ideal for writing a gift card, drawing a picture, design a poster and other creative work, this line markers highlighter is perfect for highlighting the important topics and notes in your notebook. Made from premium quality ink, it ensures provide a smooth free flow highlighting experience. The advanced technology ink does not bloat through the paper making it great for use on all sort of notebooks, magazines, reading books and other reading materials.",https://media.alshaya.com/adobe/assets/urn:aaid:aem:4ea11ccd-1a95-433f-9700-da27de6b6cfd/as/SK-J-4550182439755.jpg?width=638&height=638&preferwebp=true,https://www.muji.ae/en/buy-line-markers-highlighter-grey.html
"Polypropylene Card Case, Double Storage, 30 Cards Capacity, White",AED 19.00,White,,"Get the best of PP cardholder / 2 compartments that offer high performance. Made from high-quality polypropylene, it is durable and long-lasting. This white coloured polypropylene card case offers a double storage capacity and can hold approximate 30 cards. It has a double pocket for sorting cards. The way the front cover and back lid is opened is changed.",https://media.alshaya.com/adobe/assets/urn:aaid:aem:690053b1-ca2c-4cd0-9a6b-aacbbfc0509c/as/SK-J-4550182114539.jpg?width=638&height=638&preferwebp=true,https://www.muji.ae/en/buy-polypropylene-card-case-double-storage-30-cards-capacity-white-white.html
"Cardboard Gift Box 2, 360 X 105 X 125 Mm, Brown",AED 7.00,BROWN,,"Parcel or pack your gift in this gift box 2 and decorate with hand-made colour decorative to add your creative flavour. Specially designed in a dimension of 360 x 105 x 125mm, this box can hold a wide range of gift articles. The brown coloured gift box is made from durable cardboard that lasts longer and holds the contents safe during the logistics and rough handling.",https://media.alshaya.com/adobe/assets/urn:aaid:aem:2cc9b028-656e-4e46-97a7-39cf31e5d7b9/as/SK-J-4550002185527.jpg?width=638&height=638&preferwebp=true,https://www.muji.ae/en/buy-cardboard-gift-box-2-360-x-105-x-125-mm-brown-brown.html
"KK-1154MS 12 Digits Calculator, W 10.4 X D 17.3 X H 1.2 Cm, White",AED 59.00,White,,"Perfect for daily office carrying, business travelling, and at home in daily life application, this 12 digits calculator is ideal for convenient everyday use. The large display allows you to easily see your calculations without straining your eyes. The spacious button size with large fonts ensures effortless operation. Loaded with powerful features, and many functions, this white coloured calculator comes in a dimension of 10.4 x 17.3 x 1.2 cm. Built with a sturdy and premium material, it is strong enough for everyday use.",https://media.alshaya.com/adobe/assets/urn:aaid:aem:839f53bd-43b8-4d78-818d-444a7889fcd3/as/SK-J-4549337355538.jpg?width=638&height=638&preferwebp=true,https://www.muji.ae/en/buy-kk-1154ms-12-digits-calculator-w-104-x-d-173-x-h-12-cm-white-white.html
"Plain Rakugaki Book, 80 Sheets, B5, Neutral",AED 12.00,BROWN,,Note down the points in your classroom or at a meeting with the recycled paper notepad/plain. The smooth papers ensure clear writing without any smudges and bleeding. It is a scribble book that omits wasteful processing and decoration. This B5 size plain Rakugaki book contains 80 sheets of paper.,https://media.alshaya.com/adobe/assets/urn:aaid:aem:9fbfa01b-96f2-4d1c-914c-58b8cc790acc/as/SK-J-4550182111163.jpg?width=638&height=638&preferwebp=true,https://www.muji.ae/en/buy-plain-rakugaki-book-80-sheets-b5-neutral-brown.html
"Plain Rakugaki Book, 40 Sheets, B4, Neutral",AED 12.00,BROWN,,Put your thoughts on paper using the recycled paper notepad/plain that is crafted with smooth papers so that your thoughts flow into words without any hindrance. It is a scribble book that omits wasteful processing and decoration. This B4 size plain Rakugaki book contains 40 sheets of paper.,https://media.alshaya.com/adobe/assets/urn:aaid:aem:8c5f68af-1b02-4334-a6b4-58c17e9a190b/as/SK-J-4550182111170.jpg?width=638&height=638&preferwebp=true,https://www.muji.ae/en/buy-plain-rakugaki-book-40-sheets-b4-neutral-brown.html
"Nylon Mesh Case With Pocket, A5, Black",AED 35.00,Black,,"Ideal for office or home, this Nylon mesh pouch with pocket offer your documents and valuables complete protection. Enabled with an inner pocket, it is convenient to store small items such as notepads and office accessories. Made of light and durable mesh material that allows you to see the contents and manage them easily. The black coloured pouch is ideal for keeping A5 size files.",https://media.alshaya.com/adobe/assets/urn:aaid:aem:98557da1-62df-4db3-b97f-00bd9257f171/as/SK-J-4550182263664.jpg?width=638&height=638&preferwebp=true,https://www.muji.ae/en/buy-nylon-mesh-case-pocket-a5-black-black.html
"Cartridge For Glue Tape, Clear",AED 12.00,Clear,,"Exclusively designed for best performance and enhanced functionality, this cartridge for tape glue comes in handy to dispose of glue tape. Easy to load the glue tape and use it easily, this glue cartridge tape helps in the convenient operation. The compact size makes it easy to carry and easily store in your bag. Made from ABS resin, it is highly durable and long-lasting.",https://media.alshaya.com/adobe/assets/urn:aaid:aem:b0cd932a-e0cd-4e04-a25d-73a635e40e29/as/SK-J-4550182208115.jpg?width=638&height=638&preferwebp=true,https://www.muji.ae/en/buy-cartridge-glue-tape-clear-clear.html
