name,price,color,size,description,image,url
Compact Pen 0.5 Mm,AED 12.00,Cyan,,Compact Pen 0.5 mm,https://media.alshaya.com/adobe/assets/urn:aaid:aem:367111c1-4885-439e-9076-7d9012ac7624/as/SK-J-4550512363828.jpg?width=638&height=638&preferwebp=true,https://www.muji.ae/en/buy-compact-pen-05-mm-cyan.html
Nylon Pen Case,AED 35.00,Red,,Nylon Pen Case,https://media.alshaya.com/adobe/assets/urn:aaid:aem:6c338d2b-ab04-48e3-8fdd-cb3c81ad1979/as/SK-J-4550583109271.jpg?width=638&height=638&preferwebp=true,https://www.muji.ae/en/buy-nylon-pen-case-red.html
Nylon Pen Case,AED 35.00,Black,,Nylon Pen Case,https://media.alshaya.com/adobe/assets/urn:aaid:aem:108382f1-1bcf-45dd-bcea-c7882e0c2813/as/SK-J-4550583109264.jpg?width=638&height=638&preferwebp=true,https://www.muji.ae/en/buy-nylon-pen-case-black.html
Compact Pen 0.5 Mm,AED 12.00,Blue,,Compact Pen 0.5 mm,https://media.alshaya.com/adobe/assets/urn:aaid:aem:f18dc917-6e0c-47fa-8d5f-1ce280347efc/as/SK-J-4550344162484.jpg?width=638&height=638&preferwebp=true,https://www.muji.ae/en/buy-compact-pen-05-mm-blue.html
Compact Pen 0.5 Mm,AED 12.00,Navy,,Compact Pen 0.5 mm,https://media.alshaya.com/adobe/assets/urn:aaid:aem:f11687ae-4f7b-4b9c-b483-729026ea11b4/as/SK-J-4550344162460.jpg?width=638&height=638&preferwebp=true,https://www.muji.ae/en/buy-compact-pen-05-mm-navy.html
Compact Pen 0.5 Mm,AED 12.00,Black,,Compact Pen 0.5 mm,https://media.alshaya.com/adobe/assets/urn:aaid:aem:8bb1f334-206f-4633-82b9-3af3607d305b/as/SK-J-4550344162446.jpg?width=638&height=638&preferwebp=true,https://www.muji.ae/en/buy-compact-pen-05-mm-black.html
Compact Pen 0.5 Mm,AED 12.00,Red,,Compact Pen 0.5 mm,https://media.alshaya.com/adobe/assets/urn:aaid:aem:8d530ce4-3112-4e71-8c27-62a8d8eeb491/as/SK-J-4547315016679.jpg?width=638&height=638&preferwebp=true,https://www.muji.ae/en/buy-compact-pen-05-mm-red.html
"Nylon Mesh Vertical / Horizontal Pen Case, Dia. 6.5 X H20.7 Cm",AED 35.00,Pink,,"A pencil case that can be opened both vertically and horizontally. If you fold the handle side back and fasten the button, it can also be used as a pen stand, so it is easy to take out quickly and is convenient when you use it for a long time such as studying or working. It has a handle and is easy to carry.",https://media.alshaya.com/adobe/assets/urn:aaid:aem:775bb20f-0e1b-450b-b014-583f963ad6ae/as/SK-J-4550583847319.jpg?width=638&height=638&preferwebp=true,https://www.muji.ae/en/buy-nylon-mesh-vertical-horizontal-pen-case-dia-65-x-h207-cm-pink.html
"Nylon Mesh Pen Case With Gusset, W 18.5 X H5 X Gusset 4 Cm",AED 29.00,Ivory,,It is made of a light and durable mesh material that is easy to manage and see the contents.,https://media.alshaya.com/adobe/assets/urn:aaid:aem:ed5fd89e-17b9-45e5-b82e-b057f009fcab/as/SK-J-4550583767501.jpg?width=638&height=638&preferwebp=true,https://www.muji.ae/en/buy-nylon-mesh-pen-case-gusset-w-185-x-h5-x-gusset-4-cm-ivory.html
"Nylon Mesh Pen Case With Gusset, W17 X H10 X Gusset 5 Cm",AED 35.00,Ivory,,It is made of a light and durable mesh material that is easy to manage and see the contents.,https://media.alshaya.com/adobe/assets/urn:aaid:aem:82f040cd-6714-4220-9234-046840ac196c/as/SK-J-4550583767488.jpg?width=638&height=638&preferwebp=true,https://www.muji.ae/en/buy-nylon-mesh-pen-case-gusset-w17-x-h10-x-gusset-5-cm-ivory.html
"Nylon Mesh Bag Organiser, A4",AED 79.00,Ivory,,Made of light and durable nylon mesh fabric. It is a size that can hold A4 size notes and clear files. Dimensions: Approx. 25 × 37 × 3 cm,https://media.alshaya.com/adobe/assets/urn:aaid:aem:6eeeac88-29e6-40a5-a346-fabce8321a52/as/SK-J-4550583767457.jpg?width=638&height=638&preferwebp=true,https://www.muji.ae/en/buy-nylon-mesh-bag-organiser-a4-ivory.html
"Nylon Mesh Vertical / Horizontal Pen Case, Dia. 6.5 X H20.7 Cm",AED 35.00,Black,,"A pencil case that can be opened both vertically and horizontally. If you fold the handle side back and fasten the button, it can also be used as a pen stand, so it is easy to take out quickly and is convenient when you use it for a long time such as studying or working. It has a handle and is easy to carry.",https://media.alshaya.com/adobe/assets/urn:aaid:aem:6af287c9-c9ba-4fe8-8f91-dfe9baa2af05/as/SK-J-4550583847302.jpg?width=638&height=638&preferwebp=true,https://www.muji.ae/en/buy-nylon-mesh-vertical-horizontal-pen-case-dia-65-x-h207-cm-black.html
,,,,,,https://www.muji.ae/en/buy-nylon-mesh-pen-case-gusset-w17-x-h10-x-gusset-5-cm-pink.html
"Nylon Mesh Bag Organiser, A4, Vertical",AED 79.00,Ivory,,Made of light and durable nylon mesh fabric. It is a size that can hold A4 size notes and clear files. It is finished in a vertical shape that is easy to put in a backpack. Outer dimensions: about 34 × 27 × 3 cm,https://media.alshaya.com/adobe/assets/urn:aaid:aem:46be6c72-8d7a-42de-959c-f0a0a27a4586/as/SK-J-4550583767471.jpg?width=638&height=638&preferwebp=true,https://www.muji.ae/en/buy-nylon-mesh-bag-organiser-a4-vertical-ivory.html
Polycarbonate Double-Sided Ruler,AED 25.00,Clear,,"Folded Length: 15 cm, Unfolded (Extended) Length: 30 cm Rule life with our handy Polycarbonate Double-Sided Ruler, designed to fold in half so you can easily store it in your pouch or pocket. You can measure or use as a guide for writing lines when folded and extended.",https://media.alshaya.com/adobe/assets/urn:aaid:aem:5be7fe84-27a3-4e10-9706-b808266c744f/as/SK-J-4550512979333.jpg?width=638&height=638&preferwebp=true,https://www.muji.ae/en/buy-polycarbonate-double-sided-ruler-clear.html
"Bamboo Paper Petit Envelope Red Panda, 3 Pcs",AED 9.00,Natural,,"It is made from paper that is 100% made from bamboo harvested from Japanese bamboo forests, and features motifs of endangered animals.",https://media.alshaya.com/adobe/assets/urn:aaid:aem:7171ad1e-d468-42de-9f5a-b9b562b15027/as/SK-J-4550512979142.jpg?width=638&height=638&preferwebp=true,https://www.muji.ae/en/buy-bamboo-paper-petit-envelope-red-panda-3-pcs-natural.html
"Notepad Dot Grid, 40 Sheets",AED 19.00,White,,This is a short notepad that can be used to express a small thank you note. It is a dot grid type that can be written vertically or horizontally.,https://media.alshaya.com/adobe/assets/urn:aaid:aem:be8eb694-7f69-4d78-bd22-db568027876f/as/SK-J-4550512979012.jpg?width=638&height=638&preferwebp=true,https://www.muji.ae/en/buy-notepad-dot-grid-40-sheets-white.html
"Tpu Drawstring Bag, W 30 X L 41 Cm",AED 49.00,White,,"This water-resistant, transparent material is used for bathroom pouches. It is also convenient for separating items and taking home dirty items.",https://media.alshaya.com/adobe/assets/urn:aaid:aem:884ece58-bf37-4acf-b61b-e5c5f9d890b6/as/SK-J-4550344598153.jpg?width=638&height=638&preferwebp=true,https://www.muji.ae/en/buy-tpu-drawstring-bag-w-30-x-l-41-cm-white.html
"Tpu Drawstring Bag, W 20 X L 27 Cm",AED 35.00,White,,"This water-resistant, transparent material is used for bathroom pouches. It is also convenient for separating items and taking home dirty items.",https://media.alshaya.com/adobe/assets/urn:aaid:aem:7322bf3f-8c26-4b04-b009-bb91422bb101/as/SK-J-4550344598177.jpg?width=638&height=638&preferwebp=true,https://www.muji.ae/en/buy-tpu-drawstring-bag-w-20-x-l-27-cm-white.html
Bamboo Paper Petit Envelope Giant Panda,AED 12.00,Natural,,"It is made from paper that is 100% made from bamboo harvested from Japanese bamboo forests, and features motifs of endangered animals. It can hold bills without folding them, and is the perfect size to hold a ""tanzaku-style memo pad"" (sold separately).",https://media.alshaya.com/adobe/assets/urn:aaid:aem:01ee501f-7e43-414a-97b2-56e1f7e882a4/as/SK-J-4550512979159.jpg?width=638&height=638&preferwebp=true,https://www.muji.ae/en/buy-bamboo-paper-petit-envelope-giant-panda-natural.html
"Tpu Drawstring Bag, W 25 X L 34 Cm",AED 39.00,White,,"This water-resistant, transparent material is used for bathroom pouches. It is also convenient for separating items and taking home dirty items.",https://media.alshaya.com/adobe/assets/urn:aaid:aem:69322e28-9af2-4e12-a19b-75645026d82c/as/SK-J-4550344598160.jpg?width=638&height=638&preferwebp=true,https://www.muji.ae/en/buy-tpu-drawstring-bag-w-25-x-l-34-cm-white.html
"Bamboo Paper Petit Envelope Lucky Charm Pattern, 3 Kinds",AED 9.00,Natural,,"Bamboo paper envelopes with three lucky designs: Maneki Neko (beckoning cat), Daruma (daruma doll), and Tai (sea bream). Made from paper made from 100% bamboo taken from Japanese bamboo forests. A set of three Japanese lucky charms.",https://media.alshaya.com/adobe/assets/urn:aaid:aem:dca286e7-5190-4126-826d-91273b5e3218/as/SK-J-4550512979111.jpg?width=638&height=638&preferwebp=true,https://www.muji.ae/en/buy-bamboo-paper-petit-envelope-lucky-charm-pattern-3-kinds-natural.html
"Masking Tape , W 15 Mm X L 7 M",AED 15.00,Kraft,,This is a craft masking tape that is not printed. You can write on it with a permanent marker.,https://media.alshaya.com/adobe/assets/urn:aaid:aem:c6ba1165-236d-40fa-a1e8-e97d208d88ff/as/SK-J-4550583366834.jpg?width=638&height=638&preferwebp=true,https://www.muji.ae/en/buy-masking-tape-w-15-mm-x-l-7-m-kraft.html
"Perforated Masking Tape, W 30 Mm X L9 M",AED 19.00,Red,,"The words ""THANK_YOU"" and three types of icons are made into masking tape. Perfect for packing items that you want to send carefully. It has perforations, so you can tear each section by hand.",https://media.alshaya.com/adobe/assets/urn:aaid:aem:563ca1ab-eaf1-44e9-865c-0525d9c90668/as/SK-J-4550512979302.jpg?width=638&height=638&preferwebp=true,https://www.muji.ae/en/buy-perforated-masking-tape-w-30-mm-x-l9-m-red.html
"Perforated Masking Tape, W 30 Mm X L7 M",AED 19.00,Kraft,,Craft masking tape with perforations that makes it easy to cut. You can write on it with a permanent marker.,https://media.alshaya.com/adobe/assets/urn:aaid:aem:5c264d65-5e4f-4672-9930-9768634fa757/as/SK-J-4550512979289.jpg?width=638&height=638&preferwebp=true,https://www.muji.ae/en/buy-perforated-masking-tape-w-30-mm-x-l7-m-kraft.html
"Perforated Masking Tape, W 15 Mm X L 7 M",AED 19.00,Kraft,,Craft masking tape with perforations that makes it easy to cut. You can write on it with a permanent marker.,https://media.alshaya.com/adobe/assets/urn:aaid:aem:03cf35e3-9c41-4c48-814d-b7f444e679ba/as/SK-J-4550583366841.jpg?width=638&height=638&preferwebp=true,https://www.muji.ae/en/buy-perforated-masking-tape-w-15-mm-x-l-7-m-kraft.html
"Perforated Masking Tape, W 15 Mm X L9 M",AED 19.00,Red,,"Masking tape with ""Thank you"" written in 5 languages (Japanese, English, French, Chinese, Korean). It has perforations, so you can tear each section by hand.",https://media.alshaya.com/adobe/assets/urn:aaid:aem:4972a1a9-0629-4829-8080-2abf6db38f24/as/SK-J-4550512979296.jpg?width=638&height=638&preferwebp=true,https://www.muji.ae/en/buy-perforated-masking-tape-w-15-mm-x-l9-m-red.html
"Bamboo Paper Petit Envelope , White , 5 Pcs",AED 9.00,White,,"Bamboo Paper Petit Envelope , White , 5 pcs",https://media.alshaya.com/adobe/assets/urn:aaid:aem:3d51cdfd-1f1b-4ff4-b53d-0fa014f597f5/as/SK-J-4550512979227.jpg?width=638&height=638&preferwebp=true,https://www.muji.ae/en/buy-bamboo-paper-petit-envelope-white-5-pcs-white.html
"Non-Stick Scissors, L 15.5 Cm",AED 25.00,White,,"Non-Stick Scissors, L 15.5 cm",https://media.alshaya.com/adobe/assets/urn:aaid:aem:4e7bd1ab-04bf-47db-80ff-7e4ddeac4e25/as/SK-J-4550512979029.jpg?width=638&height=638&preferwebp=true,https://www.muji.ae/en/buy-non-stick-scissors-l-155-cm-white.html
"Double-Sided Sticky Note W 75 X L 75 Cm & W 75 X L 25 Cm ( Beige , Yellow & Blue)",AED 19.00,Multi,,"30 Sheets each . 75 x 75 and 75 x 25 sticky notes that can be used from both sides. There is glue on the top, so it won't fall apart no matter which way you use it.",https://media.alshaya.com/adobe/assets/urn:aaid:aem:a7f2920c-2e21-4c50-9f1f-95b8f240a5a0/as/SK-J-4550583366605.jpg?width=638&height=638&preferwebp=true,https://www.muji.ae/en/buy-double-sided-sticky-note-w-75-x-l-75-cm-w-75-x-l-25-cm-beige-yellow-blue-multi.html
"Bamboo Paper Petit Envelope , Red , 5 Pcs",AED 9.00,Red,,"Bamboo Paper Petit Envelope , Red , 5 pcs",https://media.alshaya.com/adobe/assets/urn:aaid:aem:a3035ee8-d599-4e37-851d-e4e584ad3520/as/SK-J-4550512979234.jpg?width=638&height=638&preferwebp=true,https://www.muji.ae/en/buy-bamboo-paper-petit-envelope-red-5-pcs-red.html
Bamboo Paper Petit Envelope With Lucky Charm Pattern - 3 Kinds,AED 9.00,Red,,"3 types of lucky charms, Lucky Cat, Daruma , 3 pcs in 1 Set",https://media.alshaya.com/adobe/assets/urn:aaid:aem:bfe8e59b-d2f0-413b-a4ee-b52ed1b06b43/as/SK-J-4550512979104.jpg?width=638&height=638&preferwebp=true,https://www.muji.ae/en/buy-bamboo-paper-petit-envelope-lucky-charm-pattern-3-kinds-red.html
"Acrylic Desktop Tissue Box, W 14.1 X D 11.7 X H 7.5 Cm",AED 29.00,Clear,,"Acrylic Desktop Tissue Box, W 14.1 x D 11.7 x H 7.5 cm",https://media.alshaya.com/adobe/assets/urn:aaid:aem:e6ae01c1-cb71-48f4-9db3-cff01a5aac05/as/SK-J-4550583410513.jpg?width=638&height=638&preferwebp=true,https://www.muji.ae/en/buy-acrylic-desktop-tissue-box-w-141-x-d-117-x-h-75-cm-clear.html
Acrylic Tissue Holder For Boxed Tissues,AED 79.00,Clear,,Acrylic Tissue Holder for Boxed Tissues,https://media.alshaya.com/adobe/assets/urn:aaid:aem:7b013704-8c7c-4c9d-886a-ad9416fd805f/as/SK-J-4550583410537.jpg?width=638&height=638&preferwebp=true,https://www.muji.ae/en/buy-acrylic-tissue-holder-boxed-tissues-clear.html
Acrylic Tissue Holder For Soft Pack Refill Tissues,AED 59.00,Clear,,Acrylic Tissue Holder for Soft Pack Refill Tissues,https://media.alshaya.com/adobe/assets/urn:aaid:aem:a5b499c5-d712-4e72-b7c2-e1a8b75b8f52/as/SK-J-4550583410520.jpg?width=638&height=638&preferwebp=true,https://www.muji.ae/en/buy-acrylic-tissue-holder-soft-pack-refill-tissues-clear.html
"Eva Binder Case For A5 , 20 Holes With Zipper",AED 9.00,Semi Transparent,,"Eva Binder Case For A5 , 20 holes with Zipper",https://media.alshaya.com/adobe/assets/urn:aaid:aem:a24dbc7a-4b68-4e17-84f3-c1651e85532c/as/SK-J-4547315028795.jpg?width=638&height=638&preferwebp=true,https://www.muji.ae/en/buy-eva-binder-case-a5-20-holes-zipper-semi-transparent.html
"Full Adhesive Deadline Sticky Note, Pink, Yellow, Blue 30 Sheets Each",AED 19.00,Multi,,"It's a sticky note where you can write dates and comments. Fully glued, it sticks firmly. The eye-catching colors and easy-to-use size make it convenient for task management.",https://media.alshaya.com/adobe/assets/urn:aaid:aem:58954bdd-0b20-47ea-b0f7-95fbe32fb75f/as/SK-J-4550583366827.jpg?width=638&height=638&preferwebp=true,https://www.muji.ae/en/buy-full-adhesive-deadline-sticky-note-pink-yellow-blue-30-sheets-each-multi.html
"Perforated Sticky Note Roll, Pink, W 5 X L 700 Cm",AED 25.00,PINK,,"Perforated Sticky Note Roll, Pink, W 5 x L 700 cm",https://media.alshaya.com/adobe/assets/urn:aaid:aem:e0c8b088-45b4-4ebf-95e8-8c14d6e67f4e/as/SK-J-4550583366810.jpg?width=638&height=638&preferwebp=true,https://www.muji.ae/en/buy-perforated-sticky-note-roll-pink-w-5-x-l-700-cm-pink.html
"Sticky Note W 25 X L 75 Cm , 100 Sheets , Yellow",AED 9.00,Yellow,,"Sticky Note W 25 x L 75 cm , 100 Sheets , Yellow",https://media.alshaya.com/adobe/assets/urn:aaid:aem:78f2a348-c541-4005-916f-0072fb88d6e2/as/SK-J-4550583366629.jpg?width=638&height=638&preferwebp=true,https://www.muji.ae/en/buy-sticky-note-w-25-x-l-75-cm-100-sheets-yellow-yellow.html
"Stick-On-Edges Checklist Sticky Note , 30 Sheets , W 6 X L 15.5 Cm",AED 9.00,White,,"Stick-On-Edges Checklist Sticky Note , 30 Sheets , W 6 x L 15.5 cm",https://media.alshaya.com/adobe/assets/urn:aaid:aem:55029b3e-08ce-4383-b7b9-10aa62ca5619/as/SK-J-4550512979258.jpg?width=638&height=638&preferwebp=true,https://www.muji.ae/en/buy-stick-edges-checklist-sticky-note-30-sheets-w-6-x-l-155-cm-white.html
"Loose Leaf Papers Kraft Cover , A5 , 20 Holes , Beige",AED 15.00,Beige,,"Loose Leaf Papers Kraft Cover , A5 , 20 Holes , Beige",https://media.alshaya.com/adobe/assets/urn:aaid:aem:a5c56b75-b7f2-4e58-8250-99354d94305d/as/SK-J-4550182913828.jpg?width=638&height=638&preferwebp=true,https://www.muji.ae/en/buy-loose-leaf-papers-kraft-cover-a5-20-holes-beige-beige.html
"Sticky Note W 75 X L 75 Cm , 50 Sheets , Blue",AED 9.00,Blue,,"Sticky Note W 75 x L 75 cm , 50 Sheets , Blue",https://media.alshaya.com/adobe/assets/urn:aaid:aem:3a4cf671-5fd9-4808-9e18-3768fa1c5fa9/as/SK-J-4550583366551.jpg?width=638&height=638&preferwebp=true,https://www.muji.ae/en/buy-sticky-note-w-75-x-l-75-cm-50-sheets-blue-blue.html
"Perforated Sticky Note Roll, Yellow, W 5 X L 700 Cm",AED 25.00,Yellow,,"Perforated Sticky Note Roll, Yellow, W 5 x L 700 cm",https://media.alshaya.com/adobe/assets/urn:aaid:aem:dbf782d5-4ce0-4f2a-8ff6-98a95018ab3d/as/SK-J-4550583366797.jpg?width=638&height=638&preferwebp=true,https://www.muji.ae/en/buy-perforated-sticky-note-roll-yellow-w-5-x-l-700-cm-yellow.html
"Perforated Sticky Note Roll, Blue, W 5 X L 700 Cm",AED 25.00,Blue,,"Perforated Sticky Note Roll, Blue, W 5 x L 700 cm",https://media.alshaya.com/adobe/assets/urn:aaid:aem:7b663004-e245-4024-a801-eca483c2ab73/as/SK-J-4550583366803.jpg?width=638&height=638&preferwebp=true,https://www.muji.ae/en/buy-perforated-sticky-note-roll-blue-w-5-x-l-700-cm-blue.html
"Eva Binder Case For B5 , 26 Holes With Zipper",AED 12.00,Semi Transparent,,"Eva Binder Case For B5 , 26 holes with Zipper",https://media.alshaya.com/adobe/assets/urn:aaid:aem:9e13ee6b-a874-404f-a06d-6ee29411e8b6/as/SK-J-4547315028788.jpg?width=638&height=638&preferwebp=true,https://www.muji.ae/en/buy-eva-binder-case-b5-26-holes-zipper-semi-transparent.html
"Perforated Sticky Note Roll , Check List, W 4 X L 300 Cm",AED 25.00,White,,"Perforated Sticky Note Roll , Check list, W 4 x L 300 cm",https://media.alshaya.com/adobe/assets/urn:aaid:aem:60837819-e6e0-435b-9fe3-1da40cc8c814/as/SK-J-4550583366780.jpg?width=638&height=638&preferwebp=true,https://www.muji.ae/en/buy-perforated-sticky-note-roll-check-list-w-4-x-l-300-cm-white.html
"Full Adhesive Sticky Note W 25 X 75 Cm , Kraft . 70 Sheets",AED 9.00,Natural,,"Full Adhesive Sticky Note W 25 x 75 cm , Kraft . 70 Sheets",https://media.alshaya.com/adobe/assets/urn:aaid:aem:5e91e231-3556-44d3-b1dc-5bc7bb4fa0db/as/SK-J-4550583366643.jpg?width=638&height=638&preferwebp=true,https://www.muji.ae/en/buy-full-adhesive-sticky-note-w-25-x-75-cm-kraft-70-sheets-natural.html
"Sticky Note W 25 X L 75 Cm , 100 Sheets , Blue",AED 9.00,Blue,,"Sticky Note W 25 x L 75 cm , 100 Sheets , Blue",https://media.alshaya.com/adobe/assets/urn:aaid:aem:eb0a4d21-a63b-4fc9-9707-bbfe50da2414/as/SK-J-4550583366636.jpg?width=638&height=638&preferwebp=true,https://www.muji.ae/en/buy-sticky-note-w-25-x-l-75-cm-100-sheets-blue-blue.html
"Full Adhesive Sticky Note , White , 30 Sheets . W 75 X L 75 Cm",AED 9.00,White,,"Full Adhesive Sticky Note , White , 30 Sheets . W 75 x L 75 cm",https://media.alshaya.com/adobe/assets/urn:aaid:aem:165aef9b-24ce-44fd-b593-bbb21c8760d4/as/SK-J-4550583366599.jpg?width=638&height=638&preferwebp=true,https://www.muji.ae/en/buy-full-adhesive-sticky-note-white-30-sheets-w-75-x-l-75-cm-white.html
"Full Adhesive Sticky Note , Grey, 30 Sheets . W 75 X L 75 Cm",AED 9.00,Grey,,"Full Adhesive Sticky Note , Grey, 30 Sheets . W 75 x L 75 cm",https://media.alshaya.com/adobe/assets/urn:aaid:aem:e0110074-5630-4563-a81f-2a9eb57c9d17/as/SK-J-4550583366582.jpg?width=638&height=638&preferwebp=true,https://www.muji.ae/en/buy-full-adhesive-sticky-note-grey-30-sheets-w-75-x-l-75-cm-grey.html
"Sticky Note W 75 X L 75 Cm , 50 Sheets , Yellow",AED 9.00,Yellow,,"Sticky Note W 75 x L 75 cm , 50 Sheets , Yellow",https://media.alshaya.com/adobe/assets/urn:aaid:aem:af2c68bc-c852-4d1b-aec6-73dcc5c3892a/as/SK-J-4550583366544.jpg?width=638&height=638&preferwebp=true,https://www.muji.ae/en/buy-sticky-note-w-75-x-l-75-cm-50-sheets-yellow-yellow.html
"Sticky Index Tab Film Type, W 31 X L 6 Cm, 10 Sheets Each",AED 19.00,Multi,,"Sticky Index Tab Film Type, W 31 x L 6 cm, 10 Sheets each",https://media.alshaya.com/adobe/assets/urn:aaid:aem:0ea988d8-2e59-42ad-9c40-49a744751b2c/as/SK-J-4550583366735.jpg?width=638&height=638&preferwebp=true,https://www.muji.ae/en/buy-sticky-index-tab-film-type-w-31-x-l-6-cm-10-sheets-each-multi.html
"5 MM Grid Sticky Note W 75 X L 75 Cm , 50 Sheets , Yellow",AED 9.00,Yellow,,"5 MM Grid Sticky Note W 75 x L 75 cm , 50 Sheets , Yellow",https://media.alshaya.com/adobe/assets/urn:aaid:aem:bd3d5c71-abc6-4fa3-aae9-0c1f68b5b51a/as/SK-J-4550583366568.jpg?width=638&height=638&preferwebp=true,https://www.muji.ae/en/buy-5-mm-grid-sticky-note-w-75-x-l-75-cm-50-sheets-yellow-yellow.html
"Perforated Sticky Note Roll , 4 Boxes , W 4 X L 300 Cm",AED 25.00,White,,"Perforated Sticky Note Roll , 4 boxes , W 4 x L 300 cm",https://media.alshaya.com/adobe/assets/urn:aaid:aem:a4088e3e-e8b1-46a5-aac9-2f28094fa958/as/SK-J-4550583366773.jpg?width=638&height=638&preferwebp=true,https://www.muji.ae/en/buy-perforated-sticky-note-roll-4-boxes-w-4-x-l-300-cm-white.html
"Eva Binder Case For A4 , 30 Holes With Zipper",AED 15.00,Semi Transparent,,"Eva Binder Case For A4 , 30 holes with Zipper",https://media.alshaya.com/adobe/assets/urn:aaid:aem:5636839d-190e-4a52-a346-1f3f1746f907/as/SK-J-4547315028771.jpg?width=638&height=638&preferwebp=true,https://www.muji.ae/en/buy-eva-binder-case-a4-30-holes-zipper-semi-transparent.html
"Full Adhesive Sticky Note , Kraft , 30 Sheets . W 75 X L 75 Cm",AED 9.00,Natural,,"Full Adhesive Sticky Note , Kraft , 30 Sheets . W 75 x L 75 cm",https://media.alshaya.com/adobe/assets/urn:aaid:aem:313b678b-d539-4601-8432-4ac4077825b8/as/SK-J-4550583366575.jpg?width=638&height=638&preferwebp=true,https://www.muji.ae/en/buy-full-adhesive-sticky-note-kraft-30-sheets-w-75-x-l-75-cm-natural.html
"Sticky Note W 75 X L 75 Cm , 50 Sheets , Natural",AED 9.00,Natural,,"Sticky Note W 75 x L 75 cm , 50 Sheets , Natural",https://media.alshaya.com/adobe/assets/urn:aaid:aem:40deaa78-4992-443f-a9f4-20d143a8a840/as/SK-J-4550583366537.jpg?width=638&height=638&preferwebp=true,https://www.muji.ae/en/buy-sticky-note-w-75-x-l-75-cm-50-sheets-natural-natural.html
"Sticky Index Tab Thick Film Type, W 35 X L 15 Cm, 10 Sheets Each",AED 19.00,Multi,,"Sticky Index Tab Thick Film Type, W 35 x L 15 cm, 10 Sheets each",https://media.alshaya.com/adobe/assets/urn:aaid:aem:0776e0ea-4543-43da-ae2a-0bb9d813c34a/as/SK-J-4550583366728.jpg?width=638&height=638&preferwebp=true,https://www.muji.ae/en/buy-sticky-index-tab-thick-film-type-w-35-x-l-15-cm-10-sheets-each-multi.html
"Sticky Index Tab Thick Film Type , W 25 X L 25 Cm , 10 Sheets Each",AED 19.00,Multi,,"Sticky Index Tab Thick Film Type , W 25 x L 25 cm , 10 Sheets each",https://media.alshaya.com/adobe/assets/urn:aaid:aem:833ba7a9-2463-4feb-86c3-0265e09235e0/as/SK-J-4550583366759.jpg?width=638&height=638&preferwebp=true,https://www.muji.ae/en/buy-sticky-index-tab-thick-film-type-w-25-x-l-25-cm-10-sheets-each-multi.html
"5 MM Grid Sticky Note W 150 X L 150 Cm , Yellow , 30 Sheets",AED 19.00,Yellow,,"5 MM Grid Sticky Note W 150 x L 150 cm , Yellow , 30 Sheets",https://media.alshaya.com/adobe/assets/urn:aaid:aem:fb19c500-e746-4732-8537-a36ac7ba8a38/as/SK-J-4550583366711.jpg?width=638&height=638&preferwebp=true,https://www.muji.ae/en/buy-5-mm-grid-sticky-note-w-150-x-l-150-cm-yellow-30-sheets-yellow.html
"Sticky Note W 25 X L 75 Cm , 100 Sheets , Natural",AED 9.00,Natural,,"Sticky Note W 25 x L 75 cm , 100 Sheets , Natural",https://media.alshaya.com/adobe/assets/urn:aaid:aem:54956cac-b3ab-4251-8666-88090936d14d/as/SK-J-4550583366612.jpg?width=638&height=638&preferwebp=true,https://www.muji.ae/en/buy-sticky-note-w-25-x-l-75-cm-100-sheets-natural-natural.html
"Planting Tree Paper Double Ring Notebook , 48 Sheet , A7 , Dark Grey",AED 9.00,Dark Grey,,"Planting Tree Paper Double Ring Notebook , 48 sheet , A7 , Dark Grey",https://media.alshaya.com/adobe/assets/urn:aaid:aem:62bd1c97-5bcc-41e4-b7b0-40e9310a9a8f/as/SK-J-4547315265008.jpg?width=638&height=638&preferwebp=true,https://www.muji.ae/en/buy-planting-tree-paper-double-ring-notebook-48-sheet-a7-dark-grey-dark-grey.html
"Loose Leaf Refill Paper, Planner Sheets, 20 Holes, 30 Sheets, A5",AED 9.00,White,,"Loose Leaf Refill Paper, Planner Sheets, 20 Holes, 30 Sheets, A5",https://media.alshaya.com/adobe/assets/urn:aaid:aem:e9fdab20-adf8-49c0-9c4e-ae9589f04838/as/SK-J-4550344296851.jpg?width=638&height=638&preferwebp=true,https://www.muji.ae/en/buy-loose-leaf-refill-paper-planner-sheets-20-holes-30-sheets-a5-white.html
"Glue Stick, 8 Gm, W 19 X D 19 X H 79 Mm",AED 12.00,Natural,,"Featuring an easy-to-use application mechanism, this glue stick conveniently twists up for use and retracts for storage. It features a solid stick formulation that helps to stick instantly. It is a compact type of mobile glue containing 8g. The non-toxic glue is permanent and can be applied with a simple rub onto paper, fabric, photos, and cardboard.",https://media.alshaya.com/adobe/assets/urn:aaid:aem:a5c6b35b-0ffd-4ff2-b263-bd35802cc36d/as/SK-J-4550344596753.jpg?width=638&height=638&preferwebp=true,https://www.muji.ae/en/buy-glue-stick-8-gm-w-19-x-d-19-x-h-79-mm-natural.html
"No-Iron Sticker Label , Each Piece W 5 X L 2 Cm , 4 X 2 Sheets",AED 15.00,White,,"No-Iron Sticker Label, Each Piece W5 x L2 cm, 4 x 2 Sheets",https://media.alshaya.com/adobe/assets/urn:aaid:aem:cd5d5c73-4172-4702-b624-132f520f3f8b/as/SK-J-4550512983286.jpg?width=638&height=638&preferwebp=true,https://www.muji.ae/en/buy-no-iron-sticker-label-each-piece-w-5-x-l-2-cm-4-x-2-sheets-white.html
"No-Iron Sticker Label , Each Piece W 3 X L 3 Cm , 6 X 2 Sheets",AED 15.00,White,,"No-Iron Sticker Label , Each Piece W 3 x L 3 cm , 6 x 2 Sheets",https://media.alshaya.com/adobe/assets/urn:aaid:aem:9578459f-26ef-475e-abfa-179f57995046/as/SK-J-4550512983293.jpg?width=638&height=638&preferwebp=true,https://www.muji.ae/en/buy-no-iron-sticker-label-each-piece-w-3-x-l-3-cm-6-x-2-sheets-white.html
